{
  "schema_version": "1.0",
  "title": "Shapes of constant width — problems and solutions",
  "language": "en",
  "updated": "2026-10-15",
  "notation_md": "Convex bodies are compact and convex. Width is Euclidean. $B$ denotes the unit ball; $B(c,r)$ a closed ball. $A$, $P$, $S$, $V$ denote planar area, perimeter, spatial surface area, and volume. $h_K$ is a support function; $h_C$ is a Cheeger constant. Angles are in radians unless degrees are shown. Unit width is assumed only when an entry explicitly says so.",
  "chapters": [
    {
      "id": "01-generalities",
      "title": "Generalities",
      "order": 1,
      "problems": "chapters/01-generalities/problems.json",
      "solutions": "chapters/01-generalities/solutions.json"
    },
    {
      "id": "02-reuleaux-polygons",
      "title": "Reuleaux polygons and disk polygons",
      "order": 2,
      "problems": "chapters/02-reuleaux-polygons/problems.json",
      "solutions": "chapters/02-reuleaux-polygons/solutions.json"
    },
    {
      "id": "03-blaschke-lebesgue",
      "title": "The Blaschke–Lebesgue theorem",
      "order": 3,
      "problems": "chapters/03-blaschke-lebesgue/problems.json",
      "solutions": "chapters/03-blaschke-lebesgue/solutions.json"
    },
    {
      "id": "04-mixed-volumes",
      "title": "Mixed volumes and the Blaschke–Lebesgue problem",
      "order": 4,
      "problems": "chapters/04-mixed-volumes/problems.json",
      "solutions": "chapters/04-mixed-volumes/solutions.json"
    },
    {
      "id": "05-meissner-polyhedra",
      "title": "Meissner polyhedra",
      "order": 5,
      "problems": "chapters/05-meissner-polyhedra/problems.json",
      "solutions": "chapters/05-meissner-polyhedra/solutions.json"
    },
    {
      "id": "06-shape-optimization",
      "title": "Shape optimization involving width and diameter",
      "order": 6,
      "problems": "chapters/06-shape-optimization/problems.json",
      "solutions": "chapters/06-shape-optimization/solutions.json"
    },
    {
      "id": "07-numerical-methods",
      "title": "Numerical simulations involving width constraints",
      "order": 7,
      "problems": "chapters/07-numerical-methods/problems.json",
      "solutions": "chapters/07-numerical-methods/solutions.json"
    },
    {
      "id": "08-open-problems",
      "title": "Open problems",
      "order": 8,
      "problems": "chapters/08-open-problems/problems.json",
      "solutions": "chapters/08-open-problems/solutions.json"
    }
  ],
  "credits_md": "Generated by ChatGPT 6 Astra."
}
